{
  "$schema": "./ac-gate-markers-schema.json",
  "version": 1,
  "_meta": {
    "description": "The intentionally-open gate markers an unchecked acceptance-criterion box may carry, with meaning, precedent and closure rule. Consolidated from the /work Step 4b marker table and the Step 5 closure-by-marker rules (#2765, target identified in #2605). Consumed by both steps; nonstop-audit.js pins the same GATE tokens as GATE_PHASES.",
    "consumers": ["/work Step 4b (force-move prohibition)", "/work Step 5 (move to in_review; closure)", "qa-extract.js (/work Step 4a — an AC already carrying a marker is not extracted again, #3161)"],
    "relatedPrompt": ".claude/metadata/ac-feasibility-prompts.json phaseFeasibility (annotationFormat, gatePhases)"
  },
  "markers": [
    {
      "id": "qa",
      "literal": "- [ ] … → QA: #N",
      "pattern": "→ QA: #\\d+",
      "meaning": "Closure deferred to a QA sub-issue.",
      "precedent": "Step 4a, Option A / #2472",
      "closure": "The box stays open until its QA sub-issue closes (see .claude/scripts/shared/lib/qa-config.json closurePath); the parent reaches done only once the box is checked. An obsolete verdict from /qa Step 1 (#2825) closes it in the struck form `- [x] ~~<acText>~~ → QA: #N (obsolete: <reason>)` — a released gate, not verified — with the marker kept verbatim so this pattern still matches."
    },
    {
      "id": "gate-review",
      "literal": "- [ ] … → GATE: review",
      "pattern": "→ GATE: review\\b",
      "meaning": "The condition resolves after the issue reaches in_review — a human read-and-approve step.",
      "precedent": "#2508",
      "closure": "Checked by the user during review; these boxes are precisely what the STOP boundary hands off, so done implies the user has satisfied them."
    },
    {
      "id": "gate-release",
      "literal": "- [ ] … → GATE: release",
      "pattern": "→ GATE: release\\b",
      "meaning": "The condition resolves during /prepare-release.",
      "precedent": "#2508",
      "closure": "Checked when the owning release step runs; if one is still open at /done, say so rather than checking it. A check that runs after the release deploys has no such step, so /done hands it off (#3453): when every unchecked box of an In review issue carries this marker, /done offers to file one standalone qa-required QA issue per criterion through .claude/scripts/shared/lib/qa-issue.js (status qa_required, no branch tracker), checks the box as `- [x] <criterion> → GATE: release → QA: #N` and closes the issue; the QA issue carries the check past the release."
    }
  ],
  "recognizedGateTokens": ["review", "release"],
  "rule": "A gate box is checked when its named resolving event has occurred, never because the issue is closing (#2726). A bare → GATE:, an unrecognized token, or the word gate in ordinary AC prose is unfinished work, not a marker."
}
